{
  "contractPath": "docs/contracts/cabinet-gemini-maintenance-evidence-packet-v1.md",
  "contractVersion": "1",
  "doesNotEstablish": [
    "gemini_available",
    "gemini_schedulability",
    "dry_run_success",
    "scan_quality",
    "claim_truth",
    "task_approval",
    "bureau_import",
    "merge_readiness",
    "runtime_correctness",
    "secret_absence_outside_curated_inputs",
    "complete_repository_context",
    "autonomous_dispatch"
  ],
  "effectFlags": {
    "cleanupActionAllowed": false,
    "commentCreationAllowed": false,
    "dumpGenerationAllowed": false,
    "externalModelExecutionAllowed": false,
    "grabowskiDispatchAllowed": false,
    "issueCreationAllowed": false,
    "prCreationAllowed": false,
    "pushOrMergeAllowed": false,
    "queueMutationAllowed": false,
    "runtimeMutationAllowed": false,
    "scheduleAllowed": false,
    "secretRequestAllowed": false,
    "taskCreationAllowed": false
  },
  "entries": [
    {
      "bytes": 4465,
      "content": "# Cabinet Agent Entry\n\nDieses Dokument ist der kanonische Einstieg für LLMs und Agenten im Cabinet-Repo.\n\n## Lesereihenfolge\n\n1. [README.md](README.md) — Entrée und Schnellstart.\n2. [docs/blueprints/ecosystem-map-v0.md](docs/blueprints/ecosystem-map-v0.md) — Zweck, Dateien, Wahrheitsgrenzen und Reifekriterien der Karte.\n3. [rendered/ecosystem-map.mmd](rendered/ecosystem-map.mmd) — lesbare Mermaid-Uebersicht.\n4. [rendered/ecosystem-registry-map.mmd](rendered/ecosystem-registry-map.mmd) — generierte Registry-Projektion aus Knoten und Kanten.\n5. [docs/blueprints/o.json](docs/blueprints/o.json) — kompakter maschinenlesbarer Seed.\n6. [registry/ecosystem/nodes.json](registry/ecosystem/nodes.json), [registry/ecosystem/edges.json](registry/ecosystem/edges.json), [registry/ecosystem/claims.jsonl](registry/ecosystem/claims.jsonl) — Graph, Kanten und Claims.\n7. [docs/blueprints/heim-pc-operatorium-index-v0.md](docs/blueprints/heim-pc-operatorium-index-v0.md) — Heim-PC als Operatorium.\n8. [docs/blueprints/cabinet-maintenance-radar-v0.md](docs/blueprints/cabinet-maintenance-radar-v0.md) — Maintenance-Radar, Scan-Grenzen und Heimlern-Rueckkopplung.\n9. [docs/blueprints/agent-routing-brief-v0.md](docs/blueprints/agent-routing-brief-v0.md) — Aufgaben- und Agentenroute.\n\n## Wahrheitsordnung\n\n- GitHub ist primär für Branches, Pull Requests, Issues und Reviews.\n- CI und Review-Gates sind primär für technische Prüfsignale.\n- Runtime, systemd, Logs und Healthchecks sind primär für laufende Dienste.\n- Contracts, Schemas und Tests sind primär für maschinenprüfbare Invarianten.\n- Menschliche Entscheidungen sind primär für Priorität, Freigabe und Abbruch.\n- Cabinet verbindet Aussagen und Bedeutung; es ersetzt die primären Quellen nicht.\n\n## Arbeitsregel\n\n1. Erst lesen, dann handeln.\n2. Bei Cabinet-Fragen vorhandene Merge-Dumps nur als Snapshot behandeln; aktuelle Repo-/PR-Zustände gegen GitHub oder lokalen Working Tree prüfen.\n3. Sidecars, Health-Berichte und Reading Packs sind Navigation oder Diagnose, keine Inhaltswahrheit.\n4. Keine Claims aus Mermaidkarten als Beweis verwenden. Die Uebersicht darf buendeln; die Registry-Projektion ist ein Driftcheck, kein Wahrheitsersatz. Graphkanten brauchen Quelle, Status und Kontext.\n5. Widersprüche sichtbar lassen und einordnen.\n6. Mutationen eng schneiden: Wegweiser, Belege oder klar begrenzte Docs/Code-Slices.\n7. Kein Merge und kein direkter Main-Eingriff ohne aktuelle Head-Prüfung, Diff-Review und berücksichtigte Findings.\n8. Erfinde keine Dateiinhalte. Wenn Kontext fehlt, fordere einen extern erzeugten RepoBrief-/Lenskit-Dump an oder benenne die Leerstelle ausdrücklich.\n\n## Organrollen\n\n- Cabinet: Sinn, Evidenz, Priorisierung, Lernen, Kartensemantik, Kohärenzradar und Wartungsbefunde.\n- Bureau: Aufgaben, Taktung, Kandidaten, Receipts, Rückmeldung.\n- Grabowski: lokale/repo-bezogene Ausführung und Review-Gates.\n- RepoBrief / Lenskit: extern erzeugte zitierfähige Kontext- und Dump-Artefakte.\n- Heimlern: retrospektive Outcome-Auswertung und proposal-only Policy-Vorschläge.\n- Steuerboard: read-only Repo-State-Signal, keine Freigabe.\n- Vibe-Lab: Methoden- und Evidence-Lab.\n- Chronik: Event-Trace und historische Kontinuität.\n- Schauwerk: Renderer und visuelle Fläche, nicht Karten-Canon.\n- GitHub / CI / Runtime: harte Realitätsprüfung.\n- Externe Agenten: Vorschlag, Review, Patch; keine direkte Mutationshoheit.\n- Gemini: vorgeschlagene proposal-only Review-/Scout-Kapazität nach Capability- und Sandbox-Preflight; nicht verifiziert, nicht einplanbar/schedulable, keine Push-, Merge-, Runtime- oder private-Kontext-Autorität.\n\n## Stop-Kriterien\n\nWenn ein Stop-Kriterium greift, brich die Ausführung sofort ab und antworte zwingend mit dem Präfix `[HARD-FAIL]`, gefolgt von einer kurzen Begründung. Starte keine weiteren Lösungsversuche.\n\nStop-Kriterien:\n\n- der lokale oder remote Zielzustand ist nicht eindeutig;\n- ein überlappender offener PR oder Worktree ist plausibel;\n- ein Schritt würde Secrets, private Runtime-Daten oder `.agents`-Runtime-Inhalte offenlegen;\n- die Aufgabe setzt eine Freigabe, Priorisierung oder Lösch-/Merge-Entscheidung voraus;\n- Tests, Gates oder Review-Evidence fehlen, sind aber für den Anspruch nötig.\n\n## Minimaler Bericht nach Arbeit\n\nGeneriere nach Abschluss exakt diese Liste:\n\n- **Geänderte Dateien:**\n- **Geprüfte Quellen:**\n- **Offene Leerstellen:**\n- **Risiko/Nutzen:**\n- **Nächste Aktion:**\n",
      "lines": 72,
      "mediaType": "text/markdown",
      "path": "AGENTS.md",
      "ref": "evidence:AGENTS.md",
      "role": "agent_rules",
      "sha256": "8d797cc8d14816de14da419794af449c16e2c3853b374174b4978a5b41752026"
    },
    {
      "bytes": 1800,
      "content": "# Cabinet Entrée\n\nCabinet ist die Sinn-, Evidenz- und Priorisierungsschicht für das Heimgewebe-Ökosystem.\n\nDieser Einstieg ist eine GitHub-Fassade. Das kanonische Inhaltsverzeichnis liegt in [Cabinet Home](index.md). Agenten und LLMs lesen zusätzlich [AGENTS.md](AGENTS.md).\n\n## Schnellstart\n\n1. **Cabinet Home öffnen:** [index.md](index.md)\n2. **Agentenregeln lesen:** [AGENTS.md](AGENTS.md)\n3. **Systemkarte finden:** [Ecosystem Map v0](docs/blueprints/ecosystem-map-v0.md)\n4. **Mermaidkarten direkt öffnen:** [lesbare Übersicht](rendered/ecosystem-map.mmd) und [generierte Registry-Projektion](rendered/ecosystem-registry-map.mmd)\n\n## Karte ansehen\n\n- **Lesbare Mermaid-Übersicht:** [rendered/ecosystem-map.mmd](rendered/ecosystem-map.mmd)\n- **Generierte Registry-Projektion:** [rendered/ecosystem-registry-map.mmd](rendered/ecosystem-registry-map.mmd)\n\nDiese Dateien sind Mermaid-Quellen. Für eine gerenderte Ansicht nutze derzeit einen Editor mit Mermaid-Preview oder einen Mermaid-Renderer. Eine spätere Leitstand-Ansicht ist der richtige Dashboard-Ort; Cabinet bleibt der kanonische Kartenort.\n\nDie Mermaidkarten sind Orientierung und Driftfläche, kein Beweis für Claim-Wahrheit, Merge-Reife, Runtime-Korrektheit oder Agenten-Autorität.\n\n## Nicht verwechseln\n\n- Dieses README ist ein Wegweiser, keine primäre Wahrheitsquelle.\n- Für Git-, PR- und Review-Zustand gilt GitHub.\n- Für technische Prüfsignale gelten CI und Gates.\n- Für laufende Dienste gelten Runtime, systemd, Logs und Healthchecks.\n- Für Freigabe, Priorität und Abbruch gilt die menschliche Entscheidung.\n- Cabinet besitzt die Kartensemantik, nicht die Wahrheit aller Quellen.\n- Gemini ist derzeit nur vorgeschlagene proposal-only Kapazität und vor Capability-/Sandbox-Preflight nicht einplanbar/schedulable.\n",
      "lines": 31,
      "mediaType": "text/markdown",
      "path": "README.md",
      "ref": "evidence:README.md",
      "role": "repository_overview",
      "sha256": "4a1704626a8378be91ae8d4f59fcfed6b214faf3e915d852e0816dc3d7835c4d"
    },
    {
      "bytes": 4121,